{"auth_scheme":"bearer","limits":{"max_assets_per_item":4096,"max_page_limit":200,"max_parts_per_asset":16384,"max_parts_per_manifest":65536,"max_request_body_bytes":65536},"part_size":{"default_bytes":1048576,"max_bytes":67108864,"min_bytes":1048576},"pin_algorithm":"spki-sha256","protocol_version":{"major":1,"minor":0},"schema_version":1,"scopes":["catalog","read","download","receipt"],"source_id":"11bba9ee-8828-4f17-8605-494e39564850","supported_major_versions":[1]}